{
  "$schema": "https://json-schema.org/draft/2020-12/schema",
  "title": "MaturaAI curated knowledge base",
  "type": "array",
  "items": {
    "type": "object",
    "required": [
      "id",
      "subject",
      "topic",
      "title",
      "content",
      "sourceTitle",
      "sourceUrl",
      "sourceYear",
      "verified"
    ],
    "properties": {
      "id": {
        "type": "string",
        "minLength": 1
      },
      "subject": {
        "enum": [
          "Matematikë",
          "Gjuhë Shqipe",
          "Anglisht",
          "Gjermanisht",
          "TIK",
          "Histori",
          "Gjeografi",
          "Kimi",
          "Biologji"
        ]
      },
      "topic": {
        "type": "string",
        "minLength": 1
      },
      "title": {
        "type": "string",
        "minLength": 1
      },
      "content": {
        "type": "string",
        "minLength": 1
      },
      "sourceTitle": {
        "type": "string",
        "minLength": 1
      },
      "sourceUrl": {
        "type": "string",
        "format": "uri",
        "pattern": "^https://"
      },
      "sourceYear": {
        "type": [
          "integer",
          "null"
        ],
        "minimum": 1000
      },
      "verified": {
        "type": "boolean"
      },
      "keywords": {
        "type": "array",
        "items": {
          "type": "string",
          "minLength": 1
        }
      },
      "sourceType": {
        "enum": [
          "educational-reference",
          "official-kosovo"
        ]
      },
      "reviewedAt": {
        "type": "string",
        "format": "date"
      },
      "reviewNote": {
        "type": "string",
        "minLength": 1
      },
      "translations": {
        "type": "object",
        "properties": {
          "en": {
            "type": "string",
            "minLength": 1
          },
          "de": {
            "type": "string",
            "minLength": 1
          }
        },
        "additionalProperties": false
      }
    },
    "allOf": [
      {
        "if": {
          "properties": {
            "verified": {
              "const": true
            }
          },
          "required": [
            "verified"
          ]
        },
        "then": {
          "required": [
            "reviewedAt",
            "reviewNote"
          ]
        }
      }
    ]
  }
}
